{
  "schema": "uzpainter/parity/envelope-registry/1",
  "current": "painter-12.2.0+js-api.1.1.20-env-a981b586eae7",
  "candidate": null,
  "envelopes": [
    {
      "envelope_id": "painter-12.1.0+js-api.1.1.20",
      "status": "superseded",
      "painter_build": "12.1.0+js-api.1.1.20",
      "painter_version": "12.1.0",
      "manifest_root": "parity/manifests",
      "record_prefix": "",
      "envelope_sha256": "0f0c8d5fec0381271fa5df51b448311b6a2e322cc96372fb97b999cb15fd119c",
      "environment_known": false,
      "equivalent_envelopes": [],
      "previous": null,
      "promoted_on": "2026-10-10",
      "superseded_on": "2026-10-11",
      "drift_report": null
    },
    {
      "envelope_id": "painter-12.1.5+js-api.1.1.20",
      "status": "superseded",
      "painter_build": "12.1.5+js-api.1.1.20",
      "painter_version": "12.1.5",
      "manifest_root": "parity/envelopes/painter-12.1.5_js-api.1.1.20/manifests",
      "record_prefix": "",
      "envelope_sha256": "1497f6497fd984cadeb5a136ce73fc41c7c601b7a6652c76fa6670be7bc4e406",
      "environment_known": true,
      "equivalent_envelopes": [],
      "previous": "painter-12.1.0+js-api.1.1.20",
      "promoted_on": "2026-10-11",
      "superseded_on": "2026-10-23",
      "drift_report": "parity/reports/phase0/oracle-envelope-drift-corpus-painter-12.1.5_js-api.1.1.20.json"
    },
    {
      "envelope_id": "painter-12.2.0+js-api.1.1.20-env-a981b586eae7",
      "status": "current",
      "painter_build": "12.2.0+js-api.1.1.20",
      "painter_version": "12.2.0",
      "manifest_root": "parity/envelopes/painter-12.2.0_js-api.1.1.20-env-a981b586eae7/manifests",
      "record_prefix": "",
      "envelope_sha256": "a981b586eae7042e972f42fa291550ceece70a3572af24ab3a84cfb87820931a",
      "environment_known": true,
      "equivalent_envelopes": [],
      "previous": "painter-12.1.5+js-api.1.1.20",
      "promoted_on": "2026-10-23",
      "superseded_on": null,
      "drift_report": "parity/reports/phase0/oracle-envelope-drift-corpus-painter-12.2.0_js-api.1.1.20-env-a981b586eae7.json"
    }
  ],
  "quarantine": [
    {
      "envelope_id": "painter-12.2.0+js-api.1.1.20",
      "painter_build": "12.2.0+js-api.1.1.20",
      "reason": "the Painter identity cannot be verified: [WinError 10061] Nenhuma conexão pôde ser feita porque a máquina de destino as recusou ativamente",
      "quarantined_on": "2026-10-23"
    }
  ]
}
